{
  "needsYou": [
    {
      "id": "<task-id>",
      "pod": "e2e",
      "status": "waiting_input",
      "a2aState": "INPUT_REQUIRED",
      "reason": "implementer hop parked a consultation (escalation=<escalation-id>)",
      "description": "Add a cache to the service",
      "priority": "normal",
      "createdAt": "<time>",
      "updatedAt": "<time>",
      "escalation": "<escalation-id>",
      "brief": null
    }
  ],
  "failed": [],
  "doneSince": [],
  "running": [],
  "next": "<time>",
  "escalations": [
    {
      "id": "<escalation-id>",
      "task": "<task-id>",
      "pod": "e2e",
      "step": "implement",
      "role": "implementer",
      "kind": "consult",
      "causedBy": "implement",
      "prompt": "Which cache should the service use?",
      "options": [
        {
          "id": "redis",
          "label": "Redis",
          "description": "already deployed",
          "risks": [],
          "estimatedTokens": null
        },
        {
          "id": "memcached",
          "label": "Memcached",
          "description": "simpler",
          "risks": [],
          "estimatedTokens": null
        },
        {
          "id": "decline",
          "label": "Decline",
          "description": "Refuse without choosing an option.",
          "risks": [],
          "estimatedTokens": null
        }
      ],
      "recommendation": {
        "optionId": "redis",
        "rationale": "it is already deployed",
        "evidenceRefs": []
      },
      "requestedSchema": {
        "type": "object",
        "properties": {
          "note": {
            "type": "string"
          }
        },
        "required": []
      },
      "askedAt": "<time>",
      "expiresAt": "<time>",
      "onExpiry": "block",
      "policy": "person",
      "level": "L3",
      "state": "pending",
      "resolution": null,
      "seq": 1,
      "affordances": {
        "options": [
          "redis",
          "memcached",
          "decline"
        ],
        "acceptsText": true,
        "resolveUrl": "/escalations/<escalation-id>"
      }
    }
  ]
}
